{
  "$schema": "https://json-schema.org/draft/2020-12/schema",
  "$id": "https://schemas.brikbyte.dev/audit-manifest/v0/schema.json",
  "title": "BrikByteOS Audit Manifest v0",
  "description": "Canonical top-level inventory and linkage contract for one BrikByteOS audit bundle.",
  "type": "object",
  "additionalProperties": false,
  "required": [
    "schema_family",
    "schema_version",
    "bundle",
    "created_at",
    "artifacts",
    "schema_inventory",
    "key_refs"
  ],
  "properties": {
    "schema_family": {
      "type": "string",
      "const": "audit-manifest",
      "description": "Stable schema family identity."
    },
    "schema_version": {
      "type": "string",
      "const": "v0",
      "description": "Explicit schema version namespace."
    },
    "bundle": {
      "$ref": "#/$defs/bundle"
    },
    "created_at": {
      "type": "string",
      "format": "date-time",
      "description": "RFC3339 timestamp indicating when the manifest was created."
    },
    "artifacts": {
      "type": "array",
      "minItems": 1,
      "items": {
        "$ref": "#/$defs/artifact_entry"
      },
      "description": "Typed inventory of artifacts contained in the bundle. Artifacts are referenced, not embedded."
    },
    "schema_inventory": {
      "type": "array",
      "minItems": 1,
      "items": {
        "$ref": "#/$defs/schema_usage"
      },
      "description": "Explicit list of schema families and versions represented in the bundle."
    },
    "key_refs": {
      "$ref": "#/$defs/key_refs"
    },
    "integrity": {
      "$ref": "#/$defs/integrity_extension"
    }
  },
  "$defs": {
    "bundle": {
      "type": "object",
      "additionalProperties": false,
      "required": [
        "id"
      ],
      "properties": {
        "id": {
          "type": "string",
          "minLength": 1,
          "description": "Stable bundle or run identifier."
        },
        "root_path_mode": {
          "type": "string",
          "enum": [
            "bundle-relative"
          ],
          "description": "Path interpretation mode for artifact references. v0 supports only bundle-relative paths."
        }
      },
      "description": "Identity and root semantics for one audit bundle."
    },
    "artifact_entry": {
      "type": "object",
      "additionalProperties": false,
      "required": [
        "id",
        "kind",
        "path"
      ],
      "properties": {
        "id": {
          "type": "string",
          "minLength": 1,
          "description": "Stable manifest-local artifact identifier."
        },
        "kind": {
          "type": "string",
          "enum": [
            "raw-result",
            "normalized-result",
            "policy-evaluation-result",
            "verdict",
            "log",
            "attachment",
            "manifest-support"
          ],
          "description": "Typed artifact classification."
        },
        "path": {
          "type": "string",
          "minLength": 1,
          "pattern": "^(?!/)(?![A-Za-z]:).+",
          "description": "Bundle-relative artifact path. Absolute host-specific paths are not allowed in v0."
        },
        "media_type": {
          "type": "string",
          "minLength": 1,
          "description": "Optional media/content type for the artifact."
        },
        "role": {
          "type": "string",
          "minLength": 1,
          "description": "Optional artifact role or purpose description."
        },
        "schema_ref": {
          "$ref": "#/$defs/schema_ref"
        }
      },
      "description": "One typed artifact reference in the audit bundle inventory."
    },
    "schema_usage": {
      "type": "object",
      "additionalProperties": false,
      "required": [
        "family",
        "version"
      ],
      "properties": {
        "family": {
          "type": "string",
          "minLength": 1,
          "description": "Schema family represented in the bundle."
        },
        "version": {
          "type": "string",
          "minLength": 1,
          "description": "Schema version represented in the bundle."
        }
      },
      "description": "One schema family/version pair present in the bundle."
    },
    "schema_ref": {
      "type": "object",
      "additionalProperties": false,
      "required": [
        "family",
        "version"
      ],
      "properties": {
        "family": {
          "type": "string",
          "minLength": 1,
          "description": "Schema family governing the referenced artifact."
        },
        "version": {
          "type": "string",
          "minLength": 1,
          "description": "Schema version governing the referenced artifact."
        }
      },
      "description": "Schema family/version metadata for a schema-governed artifact."
    },
    "key_refs": {
      "type": "object",
      "additionalProperties": false,
      "required": [
        "verdict_artifact_id"
      ],
      "properties": {
        "verdict_artifact_id": {
          "type": "string",
          "minLength": 1,
          "description": "Artifact id of the canonical verdict artifact in the bundle."
        },
        "raw_result_artifact_ids": {
          "type": "array",
          "items": {
            "type": "string",
            "minLength": 1
          },
          "description": "Optional artifact ids of raw-result payloads included in the bundle."
        },
        "normalized_result_artifact_ids": {
          "type": "array",
          "items": {
            "type": "string",
            "minLength": 1
          },
          "description": "Optional artifact ids of normalized-result payloads included in the bundle."
        },
        "policy_result_artifact_ids": {
          "type": "array",
          "items": {
            "type": "string",
            "minLength": 1
          },
          "description": "Optional artifact ids of policy-evaluation-result payloads included in the bundle."
        }
      },
      "description": "References to important artifacts for inspection and downstream bundle use."
    },
    "integrity_extension": {
      "type": "object",
      "additionalProperties": false,
      "properties": {
        "status": {
          "type": "string",
          "enum": [
            "not-recorded"
          ],
          "description": "v0 placeholder indicating integrity metadata is not yet fully defined."
        },
        "notes": {
          "type": "string",
          "minLength": 1,
          "description": "Optional human-readable note explaining current integrity state."
        }
      },
      "description": "Reserved structured extension area for future hash/signature metadata without redesigning the manifest."
    }
  }
}